{
  "$schema": "./agent-legacy-cutover.schema.json",
  "schemaVersion": 1,
  "contractVersion": "1.0.0",
  "currentOwnerSpec": "docs/03.specs/045-agent-governance-ci-qa-cutover/spec.md",
  "resultVocabulary": [
    "PASS",
    "FAIL"
  ],
  "evidenceVocabulary": [
    "repo-static"
  ],
  "retiredSurfaces": [
    "docs/00.agent-governance/contracts/agent-role-semantics.json",
    "docs/00.agent-governance/contracts/agent-role-semantics.schema.json",
    "scripts/validate-agent-role-semantics.py",
    "tests/fixtures/agent-role-semantics.json",
    ".github/ABOUT.md"
  ],
  "replacementSurfaces": [
    "docs/00.agent-governance/contracts/harness-contract.json",
    "docs/00.agent-governance/contracts/harness-contract.schema.json",
    "scripts/validate-agent-harness-semantics.py",
    "tests/fixtures/agent-harness-semantics.json",
    ".github/README.md"
  ],
  "harnessCutover": {
    "contractPath": "docs/00.agent-governance/contracts/harness-contract.json",
    "schemaPath": "docs/00.agent-governance/contracts/harness-contract.schema.json",
    "consumersKey": "consumers",
    "selectedConsumer": {
      "id": "harness-semantics-validator",
      "path": "scripts/validate-agent-harness-semantics.py"
    },
    "retiredConsumerIds": [
      "role-semantics-validator"
    ],
    "forbiddenTopLevelKeys": [
      "compatibility"
    ]
  },
  "currentAuthorityMigrations": [
    {
      "path": "docs/90.references/research/2026-08-08-wer/README.md",
      "from": ".github/ABOUT.md",
      "to": ".github/README.md",
      "count": 1
    },
    {
      "path": "docs/90.references/research/2026-08-08-wer/ci-cd-github-actions-and-qa.md",
      "from": ".github/ABOUT.md",
      "to": ".github/README.md",
      "count": 2
    },
    {
      "path": "docs/90.references/research/2026-08-08-wer/source-coverage-and-migration-ledger.md",
      "from": ".github/ABOUT.md",
      "to": ".github/README.md",
      "count": 1
    }
  ],
  "referencePolicy": {
    "packageReferences": [
      "docs/00.agent-governance/contracts/agent-legacy-cutover.json",
      "docs/00.agent-governance/contracts/agent-legacy-cutover.schema.json",
      "scripts/validate-agent-legacy-cutover.py",
      "scripts/validate-links-and-owners.py",
      "tests/fixtures/agent-legacy-cutover.json",
      "tests/test_validate_agent_legacy_cutover.py",
      "docs/90.references/data/reference-information-architecture.json",
      "docs/90.references/data/reference-information-architecture.schema.json",
      "scripts/reference_information_architecture.py",
      "tests/test_reference_information_architecture.py"
    ],
    "migrationReferences": [
      "docs/03.specs/045-agent-governance-ci-qa-cutover/spec.md",
      "docs/00.agent-governance/memory/progress.md"
    ],
    "allowedReferenceCounts": [
      {
        "path": "docs/00.agent-governance/contracts/agent-legacy-cutover.json",
        "counts": [1, 1, 1, 2, 7]
      },
      {
        "path": "docs/00.agent-governance/contracts/agent-legacy-cutover.schema.json",
        "counts": [0, 0, 0, 0, 0]
      },
      {
        "path": "scripts/validate-agent-legacy-cutover.py",
        "counts": [1, 1, 1, 1, 1]
      },
      {
        "path": "scripts/validate-links-and-owners.py",
        "counts": [1, 1, 1, 1, 4]
      },
      {
        "path": "tests/fixtures/agent-legacy-cutover.json",
        "counts": [1, 0, 0, 1, 1]
      },
      {
        "path": "tests/test_validate_agent_legacy_cutover.py",
        "counts": [1, 0, 1, 0, 0]
      },
      {
        "path": "docs/90.references/data/reference-information-architecture.json",
        "counts": [0, 0, 0, 0, 0]
      },
      {
        "path": "docs/90.references/data/reference-information-architecture.schema.json",
        "counts": [0, 0, 0, 0, 0]
      },
      {
        "path": "scripts/reference_information_architecture.py",
        "counts": [0, 0, 0, 0, 1]
      },
      {
        "path": "tests/test_reference_information_architecture.py",
        "counts": [0, 0, 0, 0, 4]
      },
      {
        "path": "docs/03.specs/045-agent-governance-ci-qa-cutover/spec.md",
        "counts": [1, 0, 1, 1, 4]
      },
      {
        "path": "docs/00.agent-governance/memory/progress.md",
        "counts": [0, 0, 0, 0, 9]
      }
    ],
    "protectedEvidenceFiles": [
      {
        "path": "docs/90.references/data/active-corpus-retention-census.json",
        "sha256": "d7052fac94af246d5254052935bc49e4a9070b06cb99160902a7e83dc7aad3e3",
        "evidenceKind": "pinned-activation-snapshot",
        "lifecycleStatus": "superseded",
        "observedAt": "2026-07-18",
        "sourceCommit": "9e2ec37f483145b322cf68a2f6e697dcf4fb80e1",
        "retiredReference": "tests/fixtures/agent-role-semantics.json",
        "supersededBy": "tests/fixtures/agent-harness-semantics.json",
        "count": 1
      },
      {
        "path": "docs/90.references/audits/2026-07-05-wea/sdlc-ci-qa-formatting-automation.md",
        "sha256": "c81e25e2346241c4ffcb83fb073ba2d7c147541dbfeadd0bdeb21bc13e004bb8",
        "evidenceKind": "pinned-ria-snapshot",
        "lifecycleStatus": "superseded",
        "observedAt": "2026-07-05",
        "sourceCommit": "8fb9821497aaa93d9ed5fc1a69b60c628b047b47",
        "retiredReference": ".github/ABOUT.md",
        "supersededBy": ".github/README.md",
        "count": 12
      },
      {
        "path": "docs/90.references/audits/2026-07-03-wdgh/workspace-document-governance-hardening-audit.md",
        "sha256": "16ebdfce8fcb4f2e82cfd47e76962b0509385c30823b3d4ece23c1b130994b4f",
        "evidenceKind": "pinned-ria-snapshot",
        "lifecycleStatus": "superseded",
        "observedAt": "2026-07-04",
        "sourceCommit": "8fb9821497aaa93d9ed5fc1a69b60c628b047b47",
        "retiredReference": ".github/ABOUT.md",
        "supersededBy": ".github/README.md",
        "count": 2
      },
      {
        "path": "docs/90.references/audits/2026-07-04-wdcn/workspace-document-contract-normalization-audit.md",
        "sha256": "bfa40f0f7e918df9dfaf0c44e5098e581a38969b7417bed2ab7fdabbdad80913",
        "evidenceKind": "pinned-ria-snapshot",
        "lifecycleStatus": "superseded",
        "observedAt": "2026-07-04",
        "sourceCommit": "8fb9821497aaa93d9ed5fc1a69b60c628b047b47",
        "retiredReference": ".github/ABOUT.md",
        "supersededBy": ".github/README.md",
        "count": 3
      }
    ],
    "terminalStatuses": [
      "archived",
      "cancelled",
      "closed",
      "complete",
      "completed",
      "done",
      "rejected",
      "retired",
      "superseded"
    ]
  },
  "scanPolicy": {
    "root": ".",
    "excludedRoots": [
      ".agent-work",
      ".git",
      ".pytest_cache",
      ".superpowers",
      ".venv",
      ".worktrees",
      "__pycache__",
      "node_modules"
    ],
    "candidateSource": "git-ls-files-z-cached",
    "resourceLimits": {
      "gitTimeoutSeconds": 10,
      "gitCleanupTimeoutSeconds": 2,
      "gitStdoutBytes": 262144,
      "gitStderrBytes": 16384,
      "candidateCount": 2048,
      "candidatePathBytes": 1024,
      "regularFileBytes": 8388608,
      "diagnosticDetailBytes": 512
    },
    "alwaysActivePrefixes": [
      ".agents/",
      ".claude/",
      ".codex/",
      ".gemini/",
      ".github/",
      "docs/00.agent-governance/",
      "scripts/",
      "tests/"
    ],
    "alwaysActiveFiles": [
      ".pre-commit-config.yaml",
      "AGENTS.md",
      "CLAUDE.md",
      "GEMINI.md",
      "README.md",
      "pyproject.toml"
    ],
    "allowedInternalSymlinks": [
      {
        "path": ".claude/output-styles",
        "target": "../.agents/output-styles"
      },
      {
        "path": ".claude/skills",
        "target": "../.agents/skills"
      },
      {
        "path": ".claude/workflows",
        "target": "../.agents/workflows"
      },
      {
        "path": ".codex/output-styles",
        "target": "../.agents/output-styles"
      },
      {
        "path": ".codex/skills",
        "target": "../.agents/skills"
      },
      {
        "path": ".codex/workflows",
        "target": "../.agents/workflows"
      }
    ]
  },
  "commands": {
    "selfTest": "python3 scripts/validate-agent-legacy-cutover.py --root . --self-test",
    "production": "python3 scripts/validate-agent-legacy-cutover.py --root ."
  },
  "exitCodes": [
    {
      "code": 0,
      "result": "PASS"
    },
    {
      "code": 1,
      "result": "FAIL"
    },
    {
      "code": 2,
      "result": "FAIL"
    }
  ]
}
